Doug Benson,lighting,Doug is sed ultrices faucibus aliquet. Ut mattis sed mauris ac tristique.
Chelsea Peretti,sound,Chelsea is eleifend lorem faucibus erat congue tempor. 
Kumail Nanjiani,costume,Kumail is raesent vitae augue mi. 
Maria Bamford,producer,"Maria is faucibus at sapien vitae, lacinia tempor enim."
Chris Hardwick,costume,"Chris is nulla in augue lacinia, scelerisque elit ac, maximus augue."
Nick Kroll,director,Nick is eu rhoncus ex bibendum vitae. Mauris pharetra orci ut nibh euismod sodales. Nulla tempus tempor pulvinar. 
Tig Notaro,sound,"Tig is donec vitae congue tellus, ut condimentum risus. Donec scelerisque massa arcu, sit amet auctor felis laoreet in. Sed quis malesuada eros. "
Amy Schumer,lighting,"Amy is suspendisse blandit dui mi, sit amet elementum velit hendrerit ac. Sed a sapien id lorem vulputate pulvinar. Nam sagittis auctor elit, ut vehicula sem tristique eget."
Aziz Ansari,costume,"Aziz is nulla in augue lacinia, scelerisque elit ac, maximus augue."
Jenny Slate,producer,"Jenny is scelerisque dapibus est, vel placerat velit dictum non. Nulla at velit et sem condimentum aliquam eu ac neque."
